subreddit,author,locked,num_comments,selftext,title,timestamp
AskHistorians,pazival_man,0,2,"Europeans had almost all of African countries colonized for at least 200 years and every African country except Ethiopia was under their rule (Yeah yeah Liberia too but they had their reasons). This is sort of the national pride here and huge sacrifices were made to maintain that independence. But I don't think that was the only reason someone didn't take over (I mean they just took over a continent), but I can't find any sources citing other reasons and asking that here would be blasphemy. So historians what were the other reasons Ethiopia remained independent for so long?",How was Ethiopia not colonized?,2019-07-03 17:54:42
AskHistorians,9XsOeLc0SdGjbqbedCnt,0,1,,"How were American slaves freed after the Civil War? How widely had news of the Emancipation Proclamation spread during the war and how was freedom for former slave protected, immediately following the war?",2019-07-03 20:04:00
AskHistorians,LightTheBurntMatch,0,1,"It’s my understanding that the kind of law enforcement systems common today first appeared around the mid-1800s (at least in America/the English-speaking world). Obviously laws themselves go back to the beginning of organized states, but how were these laws enforced without police? I’m specifically interested in European feudalism which is often depicted in media as a kind of military state, with soldiers patrolling cities and villages. If this is the case, was there any day-to-day difference between this system and the use of modern-day beat cops?",What was law enforcement like before modern (post-19th century) police departments?,2019-07-03 20:03:20
AskHistorians,Experimentalphone,0,2,"I am asking because here in Bangladesh or in most Muslim cultures, dancing between men and women is totally forbidden. I was wondering given how Christian Europe was, whether there was a similar prohibition. Or is it just that dancing between men and women has always been socially acceptable in Europe since time immemorial or when history began?",When did dancing between men and women become socially acceptable in Europe? Or was it always acceptable since time immemorial?,2019-07-03 16:16:46
AskHistorians,TheHondoGod,0,1,"It was a cult village in the middle of the jungle. I assume they could grow some food, but was it really enough to keep the whole compound fed? Otherwise they'd have to rely on funds from back in the states. Was it just coming the property of people who bought in and joined the cult? Did they fundraise?",How did Jonestown get enough funding to stay self sufficient?,2019-07-03 23:30:11
AskHistorians,stanparker,0,1,,"What sort of social status did Ancient Greek hemerodromes (messengers) have? Seems like the task of running messages for miles between cities would be awfully grueling work, but was it considered an honorable profession? How were they selected and trained?",2019-07-03 15:56:04
AskHistorians,TrappedInASkinnerBox,0,1,,"On July 4th 1863, General Lee began his retreat from Gettysburg. On that same day the beseiged Confederate garrison at Vicksburg surrendered, giving the Union control over the Mississippi River. How did leaders and the public on both sides react to this news?",2019-07-03 19:31:46
AskHistorians,takeyouraxeandhack,0,2,"I work in an archaeometallurgy lab and we recently received a few iron rings from a chainmail and after watching it under the microscope, I found out there's tin (actually, a Sn/Pb alloy, if anyone cares) between the overlapping ends of the ring. Someone suggested it was used as a mean of holding them together to rivet them easier, but I remember readig about tin being used as a coating in chainmails to prevent rusting, but I don't remember the source, and it might be my memory betraying me. Also, the rings are heavily corroded, so there's no way of telling if the rest of the ring was covered by tin as well. 

So.... is this a possibility? Was tin ever used to coat chainmail rings? 

(I don'y mind if it was in the roman age or during the renaissance or any other period).",Was tin ever used as coating in chainmails?,2019-07-03 14:28:56
AskHistorians,Pix9139,0,7,Hello! I was wondering if any of you lovely people know some good books about Gothic Architecture?? I’m doing some research for a graphic novel. Thank you all and have a lovely day!!,Books on Gothic Architecture,2019-07-03 23:10:33
AskHistorians,tumblewiid,0,1," 

**How did king and queen (husband &amp; wife) address each other in medieval England? Is it the same in public &amp; private?**

&amp;#x200B;

Would a king call his wife ""my queen"" or ""wife""? Both seem weird but I guess one of them is correct?

Would a queen call her husband ""your majesty (of the sort)"" or ""husband""? Did they go by first name with each other?",How did king and queen (husband &amp; wife) address each other in medieval England?,2019-07-03 23:10:28
AskHistorians,Vtfla,0,2,"As long as I can remember (I’m 60+), I could always tell what time it was by counting the church bells. No matter what state I lived in, it was the same. 

I know bells of the church were used to summon town folks in an emergency, but when and why did churches start keeping time?",Church as timekeeper,2019-07-03 13:10:06
AskHistorians,H4PPYGUY,0,5,"I've been looking at a few old WW2 ships recently and noticed that alot of them have a raised frontal section then at the aft the deck goes down a level. You can see what I mean just to the right of the 11 on the destroyer here: https://images.app.goo.gl/gnG1QqXey3xEvYyTA

I assume this is to stop waves coming over the front deck or something but then I can't see why modern ships don't also use this technique. Does anyone know?",Why did so many WW2 warships have a lowered aft deck?,2019-07-03 08:05:56
AskHistorians,ZealousidealStudent9,0,1,The Egyptian had used their slaves and fought the mongols at Ayn Jalut. They had copied firearms and used bronze ones to defend their nation. Egypt copied the techniques of the ottomans and mad Arquebuses similar to theirs. Did any of this knowledge spread to Nubia? If not why not? ( Nubia has been connected to Egypt for Eons),Did Egyptian ability and knowledge on how to make firearms spread to Nubia? ( or what ever it was called at the time) If not why not?,2019-07-03 22:37:10
AskHistorians,AH_LA_questioner,0,1,"During the colonization of the Americas, a lot of new churches must have been constructed, and these churches would (eventually?) need names.

I know of two church naming phenomena that jave always interested me, and I was wondering if there were any centralized rules about what names could be used with churches.

First, in many towns there is a ""First Baptist"" or ""First Methodist"" church, I suppose signifying it was the first church of that denomination in the town. Was there someone keeping track of this ordinal naming at a central committee somewhere? Or were there other rules about ordinal naming, or examples of conflict arising from disputed claims of being ""First""?

Second, many Presbyterian churches in the SE USA have names derived from biblical geography, such as Bethesda, Beersheba, Carmel, etc. Was there a standard list of names these churches could pick from? Any names that were forbidden or reserved? How did the congregation decide what the name would be?

I'm also curious if there are any other naming phenomena from this time of population growth.",Were there rules about naming new churches in the major Christian denomination during the early eras of North America?,2019-07-03 18:42:58
AskHistorians,AddisNegus,0,1,"I was wondering about this and to extension, what can and can it be considered colonialism. I’m having a debate on r/Africa on “anti-colonialism”. A term that was designated to the apparent only nation in Africa that is anti-colonialist, the dervish state. I’m arguing that Ethiopia is anti colonist also but I’m kind of biased in my view so that’s why I ask. So is the Ogaden region being handed over to Ethiopia colonialism in Ethiopia’s part?","When Ethiopia took over the Ogaden region, is that colonialism?",2019-07-03 18:37:08
AskHistorians,RoderickBurgess,0,7,"Due to poverty, or different other factors, homelessness has been a part of American urban life for centuries. There is a whole subculture in the United States that revolves around homeless people and, especially, vagrant workers, the HOBO culture.

Can someone please point to the historical moment when that subculture began to arise from the general American homeless population and summarize the historical factors made it endure for so long as it is still alive?","What are the historical origins of Homeless HOBO Culture in the United States, in the beginning of the 20th century, and what historical factors made it endure for so long?",2019-07-03 05:50:31
AskHistorians,Go_To_Bethel_And_Sin,0,2,,Did angry mobs in the Middle Ages ever actually run people out of town with pitchforks and torches?,2019-07-03 05:22:32
AskHistorians,td4999,0,1,"to maintain a middle class lifestyle, that is?","Was the typical household depicted on television in the 1950s, with a professional and a homemaker living a comfortable middle class existence on one income, realistic at the time? Once this became less common was there any backlash to the necessity that both partners would have to work?",2019-07-03 04:49:55
AskHistorians,Jfrsng,0,3,"I don’t get how they can be friends prior to the war and united. 
Then all of a sudden the south has their own army and uniforms and started attacking. 
Did they feel bad for fighting Americans ?",Did Americans feel uneasy about fighting Americans in the civil war ?,2019-07-03 21:19:54
AskHistorians,EnclavedMicrostate,0,4,,"The Romans believed that it was (usually) inauspicious to bury bodies within city bounds, but the pomerium (city boundary) of Rome was frequently expanded. Did these extensions end up encompassing burial grounds, and if so what was don about it?",2019-07-02 20:08:24
AskHistorians,DuchessLizi,0,1,"I recently ran into [this piece Du Bois wrote on Stalin's death](https://www.marxists.org/reference/archive/stalin/biographies/1953/03/16.htm). I know ""[marxists.org](https://marxists.org)"" might not be the best place to get your history, but I found a UMass Amherst archive page saying that this article does exist, and several other sites posting this exact text, so I believe it's legitimate. Anyway, I wanted to put it into perspective of what Du Bois would've known in 1953 when he wrote it, particularly regarding The Ukrainian Famine and The Great Purge.",How well were the actions of Stalin's regime known outside the Soviet Union in his lifetime?,2019-07-03 12:07:51
AskHistorians,Hermanneutics,0,1,"When I was growing up, I always learned that the number of deaths in the Civil War was somewhere around 500,000. As I'm reading Brenda Wineapple's new book ""The Impeachers,"" she mentions that the new consensus among scholars is around 750,000. I understand that the number probably changes as we acquire new sources, but what sources do historians use to get at this number, and what methodologies are most useful in establishing a data point like this? It's something that's always puzzled me.",How do historians estimate the number of deaths during the American Civil War?,2019-07-03 20:48:34
AskHistorians,Gaham,0,2,,During the time of telegraphs did anyone ever get prank called? Was it even possible or were all telegraphs business ran?,2019-07-03 20:25:27
AskHistorians,Schwabenland,0,2,,Was only the pope allowed to excommunicate people in the middle ages?,2019-07-03 20:15:02
AskHistorians,JoshLDN,0,1,"I am researching the Spanish anarcho-syndicalist movement and in much of their coverage of the buildup of hostilities during the early 1930s (during Hitler's rise to power, before the Nazi buildup) they refer to the USSR as having the biggest and/or best military in the world – was this a widely held perception?",Was it common for people to regard the Soviet Red Army as the world's most powerful military during the early 1930s?,2019-07-03 09:14:09
AskHistorians,Captainj0nes,0,1,"Like romantic dateing, when did that become the preferred way to find a spouse instead of arranged marriage. I'm more talking about in the western world, I know in places like India arranged marriages are still pretty normal.",When did dating become a thing?,2019-07-03 19:44:48
AskHistorians,RusticBohemian,0,2,"Also, would pirates, raids, and seaborne invasions have been considered realistic threats to Rome during the pre-Byzantine era? I know vikings raided the late Byzantine empire many times, but I've never heard of these type of threats bothering Rome when it was a united Empire.","Did Rome post ships or man watch towers at the Straights of Gibraltar and Sea Of Marmara to protect their ""Roman lake,"" from pirates, raids, and invasions from the Atlantic and Black Sea?",2019-07-02 19:16:11
AskHistorians,ColonelBy,0,1,,"What made the trend of ""World Fairs"" and other expositions so popular in the late-19th/early-20th centuries? What caused them to die out?",2019-07-03 13:20:18
AskHistorians,Shurikino123,0,4,"I've seen a lot of instances where Winston Churchill for example flew to Russia, Egypt, etc. How did he manage to fly over German occupied territory?",How did political leaders planes not get shot at during world ward 2?,2019-07-03 15:08:04
AskHistorians,Chips1001,0,8,I once read that the US once signed a treaty with the Barbary states that states in one of it's articles that the US must pay them money. Is there any truth to that?,Was the US once a tributary?,2019-07-03 12:53:30
AskHistorians,13141314Dankeee,0,2,,From Hamilton’s lyrics ‘The doctor turned around so he could have deniability’. Is this a rule most doctors follow during a duel? When in history was it rooted from?,2019-07-03 12:52:21
AskHistorians,SzurkeEg,0,1,"In classical times, there was a significant Greek presence in North Africa, particularly between Egypt and Carthage. Later, these people would have considered themselves to also be Roman.

But nowadays, no one really considers themselves to be Greek or Roman in North Africa. Why is that? My understanding is that in the case of Asia minor, this is due to a combination of Turkic invaders, prestige of the ruling elite, deaths due to epidemics, and migrations to Greece (both voluntary and not). I've also heard that the decline of Rome in North Africa can be partially attributed to ecological decline (e.g. Silphium).","North Africa: What's the relationship between the decline of the Roman Empire, the invasions of the Vandals/ERE/Muslims, and the encroachment of the Sahara in North African cultural identity?",2019-07-03 12:47:16
AskHistorians,Nothink,0,1,"Wikipedia says:

&gt;The 2001 documentary Japanese Devils was composed largely of interviews with 14 members of Unit 731 who had been taken as prisoners by China and later released

source cited:  田辺敏雄 『検証 旧日本軍の「悪行」―歪められた歴史像を見直す』 自由社 ISBN 4915237362","The Members of Unit 731 Who Were Captured by the Chinese, Were Later Released, But Why?",2019-07-03 09:54:16
AskHistorians,TheKillerRabbit42,0,2,"I'm aware of how this would contradict with the Nazi's view of women's role in society and how (what were at the time) such drastic measures might lead to a second ""stab in the back"" in the eyes of the Nazi's. I'm also aware of how they made ""use of"" so to say of forced and slave labor from POWs and civilians in occupied territory. Are there any other factors at play that make Germany seemingly appear as an outlier compared to other nations?",Why did the Nazi's not mobilise the female population of Germany to replace the jobs made empty from conscription.,2019-07-03 18:36:53
AskHistorians,clarka2891,0,2,"I have a broad inquiry about any of the three above questions, not all three have to be answered separately. It’s common in the literature to see that Billy Graham, Jerry Falwell (Moral Majority) are responsible for Reagan’s election over Carter, but did Reagan actually do anything for them?",To what extent was Reagan’s presidency affected by evangelicalism? Did he actually work on these issues? Did the Christians actually get him elected?,2019-07-03 14:31:06
AskHistorians,rogthnor,0,1,They were apparently pretty good commanders themselves as they took over for their father in the last battle when he died,What happened to the children of Admiral Yi?,2019-07-03 18:02:34
AskHistorians,sass_basket,0,11,"I have specifically always heard stories about how every man of draft age was conscripted to fight in world war 2. Heck, there were even songs written about how all the men left were too young or too old. 
As a female firefighter myself I know better than anyone that women are perfectly capable of doing the job but I have trouble believing that the times allowed for it. So, in times of all-out war, specifically ww2, who did serve as first responders? Was it women/older men? Or were there exceptions made? If so, how did they determine that?",Who served as firefighters and policemen during the world wars or other major conflicts?,2019-07-03 03:39:55
AskHistorians,pedro3131,0,4,"Got in a debate with one of my friends who lives down in South Carolina and he posed a theory I had never heard before. I'll post his abridged comments (he's got some long windup about educating some ungrateful millennial which I'll chop out) down below but the Crux of his comment was that we only celebrate July 4th because of a military victory in South Carolina.

Now I've done some light reading on the topic (McCullough, Phillips, Bunker, Ellis, as well as a good deal of Jefferson and Adams letters) but I'd never heard this before. I can accept that maybe this victory influenced the South Carolina delegation (even then I'm not sure, as being from PA all my education focused around Dickinson and Morris) but is there any greater truth there?

""I asked this gentleman if he had any idea why we celebrate the 4th. I reminded him that the Battle of Sullivan's Island was a decisive victory over the Bittish Royal Navy that not only secured Charleston Harbor from the invading Brittish but it sent them high tailing their Navy to New York. SC delegates rode to Philadelphia and informed our founding fathers of this victory and they struck, declared independence from England as a result of this great victory. (Keep in mind that Charleston was one of the richest ports of the day) Certainly, we would be celebrating our independence but it may have been a completely different date had it not been for this South Carolina victory. (Take that Bean Town) Indeed, South Carolina has a rich history that often goes unnoticed.""

Thanks in advance!",Why did South Carolina Vote for Independence?,2019-07-03 17:13:56
AskHistorians,Aceze,0,2,It was even mentioned that it may even lead to an alliance if the Germans acted right.,I've read somewhere that the United States was more inclined to support or help the German Empire during World War 1 if the Germans didn't attack US ships in the Atlantic. Is there any basis for this statement?,2019-07-03 02:44:03
AskHistorians,redditRW,0,1,"I'm not looking for information on children who were sent on a train to the frontier, but orphans who were already there.

If anyone can just point me in the direction of a study, book, etc. I would be grateful.

Trying to research the time period after the Revolutionary War to just before the Civil War.  1789-1840.

Many Thanks.",Can You recommend Any Sources for Researching What Happened to Orphans of families in the westernmost settlements of the US (1789-1840)?,2019-07-03 17:00:32
AskHistorians,NDRanger414,0,3,"Since im starting high school next year, im starting to think about my future. History is really my passion, but can I turn a career into it? Does a history major make good money? What jobs are available? I know liberal arts is going on the downfall and a specialized skilled field is good. So I ask historians, can I make a career out of history?",Can I make a good career in history?,2019-07-03 17:00:19
AskHistorians,zach3141,0,2,"I grew up in the midwest, where many of the nearby cities have indigenous names (Milwaukee, Chicago, Minneapolis, most small towns in Wisconsin). But now i live in California, where all the major cities i know of have Spanish names (San Francisco, Palo Alto, Los Angeles, San Diego). I imagine this is due to differences in Spanish vs French/English colonial policy, why did the Spanish not keep any indigenous city names while the English did?","Why do cities in the Midwest keep their indigenous names, but in California they were all changed to Spanish?",2019-07-03 16:56:47
AskHistorians,gerradisgod,0,2,,"Did Emperor Hirohito have the power to end Japan's war in the Pacific? If so, why did he not end the war?",2019-07-03 16:50:10
AskHistorians,Frigorifico,0,4,"I've heard the saying: A language is a dialect with an army, case in point, since Portuguese and Spanish speakers can understand each other without switching to a common language they would probably be considered a single language, but they are spoken in different countries, so they are considered different languages.

Then we have the case of China where the speakers of the many ""dialects"" can't understand each other and have to switch to a common ""dialect"", Mandarin. When people can't understand each other when they speak we call those different languages but the Chinese government insists they are dialects and so the world just rolls with it.

My question is, when did this start?, were the many Chinese languages recognized as such in one of the many time periods when China wasn't unified?, or has chinese culture always insisted they speak the same language?, if so, why?",When did all the languages of China started being considered dialects of a single language?,2019-07-02 21:44:16
AskHistorians,SombaChan,0,1,"As the title says. Thank you for anyone who answers! When I say earlier periods, I’m thinking of the very early periods of history; the dark ages, for example, as well as any other periods you might think interesting.","How was mental illness (depression, anxiety, schizophrenia, etc) seen and treated in earlier periods of human history?",2019-07-03 12:53:22
AskHistorians,Retrolord008,0,2,"I’ve taken an interest in WW2 history especially on the Burma front. I noticed that a lot of regiments of the British Indian army are named based on ethnicities...

Gurkha regiment, Baluch regiment, Punjab regiment, dogra regiment etc...

Naturally these regiments would have people from these areas in them...but what about people from other places?

For example...there’s no Bengali regiment. I know they had a famine but surely at least a couple of Bengali’s must’ve served in WW2? How would a Bengali be assigned a regiment and brigade? 

Could a Bengali serve in the  Gurkha regiment, dogra regiment or Punjab regiment for example...

Side question- 5th indian infantry division went from the Middle East to Burma in 1943. They were considered “battle hardened “

So if they were all considered battle hardened and experienced ....does that mean they never got any new recruits? How?

Sorry I’m not too knowledgeable about military manoeuvres and all but thanks for the help!",Could Indians in WW2 only serve in regiments based on their ethnicity?,2019-07-03 04:58:30
AskHistorians,Legataux,0,1,"I was playing EU4 and the best trade node in the early game is in the Mediterranean. As the game advances and the European colonizers have a tighter grip on the new world the best trade node to have changes toward the Atlantic ocean.

&amp;#x200B;

That got me thinking.",Did the Ottomans lose power because European trade shifted to the Atlantic?,2019-07-03 04:36:00
AskHistorians,kinapudno,0,2,,The Philippines is known to have the biggest gay pride celebrations in South East Asia despite being its only Catholic country. Some Filipino historians explain this by claiming that the Philippines' precolonial society accepted LGBT+ before its Christianization. What's the basis of this claim?,2019-07-02 22:01:53
AskHistorians,NotNoble,0,1,"Hi, I’m a high school student from Nepal and I’m representing The United Kingdom in a Historical committee in a Model UN and the actual committee session is taking place at November 26, 1950. I would love to get inputs from Historians as to how it could have been prevented or how it’s consequences could have been minimised?",What could have been the best measures to prevent The Korean War?,2019-07-03 15:23:32
AskHistorians,U-N-C-L-E,0,1,"It seems like the use of stars and stripes broke free from the European tradition of tricolors and crosses. Do we have any documented ""reviews"" of the design from outside the U.S.? 

Also, do we know what Ms. Ross' influences were? Was she a known vexicologist? Did she do all the design work herself or did she have a staff?",What was the early international reaction to Betsy Ross' flag Design?,2019-07-03 15:21:18
AskHistorians,AutoModerator,0,84,"[Previous](/r/AskHistorians/search?q=title%3A""Sunday+Digest""+OR+title%3A""Day+of+Reflection""&amp;restrict_sr=on&amp;sort=new&amp;t=all)

Today: 

Welcome to this week's instalment of /r/AskHistorians' Sunday Digest (formerly the Day of Reflection). Nobody can read all the questions and answers that are posted here, so in this thread we invite you to share anything you'd like to highlight from the last week - an interesting discussion, an informative answer, an insightful question that was overlooked, or anything else.","Sunday Digest | Interesting &amp; Overlooked Posts | July 01, 2019–July 07, 2019",2019-07-07 14:04:52
