subreddit,author,locked,num_comments,selftext,title,timestamp
AskHistorians,Errk979,0,1,"I'm interested in how we've gone from a kingdom in the 18 hundreds to a ""Chinese"" province today, and how any movements, but particularly nationalism, has affected it.",What did early Tibetan nationalism look like? How did it come to take form?,2019-07-07 20:04:15
AskHistorians,Weekend_metalhead,0,1,"I heard ""GCHQ: centenary edition"" by Richard Aldrich was a good read. I'm open to any other recommendations",Good non-fiction books on British intelligence?,2019-07-07 19:54:18
AskHistorians,Herenus,0,1,"It seems the castle was built shortly before or around the time of the war - and also seems to have had relatively strategic attributes (i.e. the loch, near Edinburgh) so it must of had some importance in the war if it had been built yet - or at least I would assume so?","Did Loch Leven castle in Scotland, north of Edinburgh, serve any importance during the first Scottish War of Independence?",2019-07-07 19:50:58
AskHistorians,TheGOATofgoats999,0,2,Both games stretch from 1899 to 1914.,"How historically accurate is the representation of the American West in the Red Dead Redemption series? In terms of weapons, clothing, technology, crime, law, government, the situation of Native Americans, etc.",2019-07-07 18:12:17
AskHistorians,PsychoSwine,0,1,"I know that the jewish faith did spread out from the region of modern day Palestine and Israel, however I would like to know how the jewish kingdom of Semien formed in Ethiopia.",How did the Jewish kingdom of Semien come to be?,2019-07-07 15:44:47
AskHistorians,KillAllFurries0906,0,3,,"I'm a paratrooper in WW2, just as we are about to jump the plane gets shot down so we parachute out the back to escape the burning plane. Are enemy planes and AA guns allowed to shoot at me?",2019-07-07 21:37:17
AskHistorians,GodAlmighty69,0,9,"The narrative we sometimes hear now is ""Constantine beat his Roman rivals and became emperor. He was more pro-Christian than his rivals. So this a huge reason why Christianity became big"" 

&amp;#x200B;

But how big was Christianity right before Constantine wins? As in, was its momentum already so great that it would have eventually became dominant without Constantine? How did Christianity get in the running to become a huge religion that an emperor would be willing to throw his weight behind? 

&amp;#x200B;

It must have already been pretty big for Constantine to decide to throw his weight behind it, right? 

&amp;#x200B;

I listened to the History of Rome podcast by Mike Duncan. I am trying to fill in the gaps in my mind between these eras:

&amp;#x200B;

1) Christianity looks like a new, small offshoot of Judaism and so *Pontius Pīlātus* just decides to crucify Jesus

 2) Christianity has underground organizations around Europe 

3) Mike Duncan in his podcast describes Christianity as becoming a religion for poor people and women. And it is seen as a sign of decline of the empire by the aristocracy. 

&amp;#x200B;

...And then I am trying to get a bigger picture of how we get from 3) to ""Christianity has enough popularity/acceptability that a Roman emperor would be amenable to it"" 

&amp;#x200B;

**Was the forward momentum towards monotheism and Christianity already inevitable by Constantine's time?**",Did Christianity and monotheism already have inevitable forward momentum/increasing popularity before Constantine such that it would have come without his support of it?,2019-07-08 01:21:33
AskHistorians,AstroMechEE,0,1,"The article in question: https://www.technologyreview.com/s/613756/sending-people-back-to-the-moon/

If true, do we know any details of the scope of the project? Would it be a plan to design an ""open source"" desalination plant that 3rd world nations could build themselves, or did it involve a Marshall-plan style commitment to building desalination plants in nations that could use them?","In an article on future trips to the moon, author Oliver Morton says that JFK was initially considering a project to create desalination plants for the providing of clean water as an alternative to the moon landing as a showcase of American engineering acumen and industrial might. Is this true?",2019-07-07 21:35:06
AskHistorians,TanktopSamurai,0,1,,"What was the comic book fan reaction in pre-2000s to the introduction of black superheroes, especially when they replaced an already existing white hero like Green Lantern?",2019-07-07 07:58:48
AskHistorians,Atrotus,0,1,I know that Czechoslovakia was practically betrayed by allies twice. First being the Munich diktat and second being left to the soviets after ww2. How did this affected the Czechoslovakian opinion about NATO&amp;western democracies after ww2?,Czech opinion about Allies/Western democracies after WW2,2019-07-07 17:36:34
AskHistorians,Viejoso,0,5,,"After Julius Caesar was deified after his death did he become the god of something or did he just become ""Julius Caesar the God""?",2019-07-07 02:26:06
AskHistorians,NonSocialTeen,0,3,"In a YouTube video called ""Joseph McCarthy responds to Edward R. Murrow on ""See it Now"" - April 6th 1954"" he states quote, ""Communists in our government, who gave american dollars and american support to the communists in Poland"". I however haven't found anything online relating to this. So my question is whether or not he is flat out lying, or twisting the facts around. Thank you in advance!",Was Joseph McCarthy accurate in this interview?,2019-07-08 01:04:47
AskHistorians,pdattle,0,1,,"I recently learned about Pancho Villa, his raid of a small border town in New Mexico, and the subsequent U.S. military incursion into northern Mexico. What political mechanism was used by the United States to justify the action and how was it perceived by other nations at the time?",2019-07-07 17:22:47
AskHistorians,yuffmymateria,0,5,"Its nothing elaborate and i was just wondering why we stopped using it, it seems to me like a really effective way of execution and cost effective.",Why did we stop using the guillotine?,2019-07-07 18:56:03
AskHistorians,warflak,0,2,"The aim of their wars was somewhat similar (taking China back from Japan and taking parts of Spain from the Nationalists), and even the factional issues within the countries were similar (Barcelona during the May Days, seeing the anarchist CNT-FAI and POUM fighting the Republic and Communists and the New 4th Army Incident between the Nationalists and Communists). Both countries had ties with the Soviet Union, both parties had alliances with the Communists, and their initial timelines were similar (‘36 during Spain and ‘37 during China). In fact China was already in a far worse position than Spain, dealing with Japan AND a civil war years before Spain did. Indeed, China didn’t get much outside support besides the Flying Tigers until 1942 when Stilwell showed up. So why did China get priority(after 5 years of holding alone) and Spain was left to fall?","Why did the Chinese NRA get assistance from Western Europe through arms shipments from France and Britain among others, but not the Spanish Republicans during the civil war?",2019-07-07 18:45:18
AskHistorians,FerventQuibbler,0,1,"Throughout my history experience from middle school through college, hints have always been dropped in books such as _Empire of the Summer Moon_ that the Comanche tribe stopped or slowed the advancement of New Spain, the Republic of Texas, and the United States from fully controlling its frontier territories/states until its downfall against the Americans after a long and brutal war. As one can imagine, during the 1600s-1700s it became important for Spain, France, and potentially Britain and Russia to set their sights on this frontier as they expanded towards this area. What truth is there to the above two statements, and if so, were any other tribes involved in this “empire” or is the entire “empire” concept exaggerated?",The Comanche “Empire”...legitimate threat or overblown?,2019-07-07 14:58:31
AskHistorians,Xxxn00bpwnR69xxX,0,1,,"How did the people of Iranian Azerbaijan react to the accession of the non-Azeri, Persian Pahlavi Dynasty?",2019-07-07 20:43:21
AskHistorians,matejcx,0,1,,When did atheism stop being punished in european countries? When did regular people started being atheist?,2019-07-07 18:27:19
AskHistorians,Meninaeidethea,0,1,,"When did the British begin to think of/refer to their government as ""democratic""? Did this vary among different parts of society?",2019-07-07 14:29:21
AskHistorians,GodAlmighty69,0,1,"At the bottom of this article [https://mymodernmet.com/art-history-of-cupid/](https://mymodernmet.com/art-history-of-cupid/), in the middle ages portion, it seems like Cupid kept on being a popular figure  long after Aphrodite, Zeus  etc all fell out of favor in art

&amp;#x200B;

Wikipedia quote:

""Cupid continued to be a popular figure in the Middle Ages, when under Christian influence he often had a dual nature as Heavenly and Earthly love. In the Renaissance, a renewed interest in classical philosophy endowed him with complex allegorical meanings. In contemporary popular culture, Cupid is shown drawing his bow to inspire romantic love, often as an icon of Valentine's Day.\[2\] ""

[https://en.wikipedia.org/wiki/Cupid](https://en.wikipedia.org/wiki/Cupid)

&amp;#x200B;

**Yes, but there must be something specific about Cupid that made him different than other ancient figures of love like Aphrodite. Why didn't Aphrodite become a figure of Heavenly and Earthly love in the middle ages?** 

&amp;#x200B;

Offhand, my first gut guess is ""well, Augustus has a cupid by his knees in Prima Porta just to show the emperor's divinity-- so perhaps putting cupids near figures didn't carry the stigma of cupid being a full blown pagan God that needed to be damned?""

&amp;#x200B;

And my second guess is that cupid looks a bit like angels, so perhaps he translated better into the Christian world of the middle ages than other ancient Greek entities? Weren't many of the pagan statues destroyed / seen as false gods  in iconoclasm? 

&amp;#x200B;

And my only other guess was that maybe is he just cute and small- and that's why he remained popular? Then again, alot of medieval depictions of cupid in books do not portray him as cute- they often give him the face of an old man and adult proportions sometimes. 

&amp;#x200B;

**So what is the real answer why Cupid was spared from the damnation/fall in popularity that other pagan figures went through? (if we assume Cupid did originate from Eros)**","If Cupid originates from the ancient Greek Eros, why did Cupid remain so popular in art in the middle ages despites being a pagan in origin? What made him different than other figures from Greek mythology that he survived the iconoclasm and the drop in popularity of other Greek mythology figures?",2019-07-08 00:12:44
AskHistorians,Mochain,0,1,"I was wondering how and if the emergence of Japan as an imperial power changed the dynamics and volume of maritime trade in the region, considering that Japan had limited contact with the rest of the world during the Tokugawa shogunate.",How did much of the changes in maritime trade in East and Southeast Asia from the Meiji Restoration in 1868 to the surrender of the Japanese Empire in 1945 can be attributed to Japan?,2019-07-07 13:32:44
AskHistorians,London_Irish_,0,2,"Last night I rewatched a favourite movie of mine - Master and Commander: The far side of the world. 

I've seen it a fair few times but noticed this scene last night. https://youtu.be/GkzdGvp6q_Y

If you look carefully the young officer (a midshipman I believe) sat at the table has a glass of wine in front of him. 

Now later in the film that young officer leads a boarding party onto an enemy ship so the appropriateness of his drinking is kind of a moot point. At the time 12 year olds kids were taken into the navy to be trained up.

But it has me curious. When did it go from ok for children to drink to being unacceptable?",When was it decided that children shouldn't drink alcohol?,2019-07-07 10:36:53
AskHistorians,Mrdingawing,0,1,"So I’ve heard many people argue back and forth as to whether or not the Soviet Union actually fit the definition of a communist country. Those who claim it wasn’t actually communist will stay instead that it was socialist but I still see disagreement on that front as well. Just looking for an answer, thanks",Was the Soviet Union actually communist/socialist?,2019-07-07 20:14:37
AskHistorians,southern_ms_girl_11,0,1,,Are there any famous historic Protestant pilgrimage sites outside of the Holy Land?,2019-07-07 19:49:31
AskHistorians,Certainly-Not-A-Bot,0,1,It’s well known that Brahms in particular opposed the use of valves on brass instruments. What did other composers and also the players of these instruments think about the new invention?,What was the response of musicians to the introduction of valves?,2019-07-07 19:49:02
AskHistorians,negativityguru,0,1,"Hey all generous enough to read,
I’m an undergrad about to enter sophomore year in history. I’m planning on law school, but my dream would be to study and teach history at the academic level. I am also planning to volunteer in the peace corps for 2 years after undergrad, so I am still 5+ years out from even beginning a postgrad route. Will there be growth in the stereotypically dead academic job market through stress on institutions as populations continue to grow throughout the century? And what about university teaching positions in history abroad? Thanks!",Growth in Academic Job Market?,2019-07-07 23:32:50
AskHistorians,Jaemason19,0,1,"I’ve read about the attacks and the incident and I was wondering how it was able to kill over 400 people. I imagine that they had weapons and traps set up. They also must have dealt with tigers for a long time. So how was the tiger able to escape death/capture/hunting for so long?
*does anyone know why the tiger did it either?",Why was the Champawat Tiger able to kill so many people?,2019-07-07 14:39:31
AskHistorians,military_history,0,1,,"How well-informed were citizens in Nazi-occupied France, Belgium, Holland and Luxembourg about the progress of the Allied campaign beginning on D-Day which would result in their liberation?",2019-07-07 17:25:30
AskHistorians,Jesseboy913,0,2,,Who was king tut?,2019-07-07 17:15:09
AskHistorians,lostduck86,0,13,"What is the history behind this, why do you/they do this. It is so over reaching it feels like to me?","The mods here remove almost all the comments on almost every post and it is driving me crazy, I just want to learn some history and see different peoples takes.",2019-07-08 12:41:45
AskHistorians,tutu32,0,2,,How was soccer (and any other timed sport for that matter) played before timers and watches?,2019-07-07 15:33:35
AskHistorians,fastasfukbois,0,3,Wasn't Lithuania much larger than Poland before the union of their thrones? Why did Poland inherit so much of the Grand Duchy of Lithuania?,Why is Lithuania so much smaller than Poland?,2019-07-07 19:09:58
AskHistorians,coconut47,0,1,After WWI germany had to dismantle its weapon industry due to the treaty of versailles . But what happened to all of those weapon factories and did the steel industry suffer because of the low demand for steel ? What other types of industry became more lucrative ? When Hitler came to power did he have to change a lot of the industry or did things settle due to the gay 20's ?,How did german industry change after WWI,2019-07-07 19:03:58
AskHistorians,eamesheard,0,1,,"How did highways (before the interstate system) exist in Atlanta, Georgia? How were they planned and how did they affect the city?",2019-07-07 14:02:49
AskHistorians,ckel1221,0,2,I’ve always wondered what medical costs meant for people financially before the dawn of modern healthcare.,"In ancient times, was medical care affordable, or did chronically ill, working class people have to go into debt to pay for treatment?",2019-07-07 13:46:39
AskHistorians,mltreado,0,2,The surprise attack on pearl harbor was a huge success for Japan. Would Japan have been able to successfully complete an invasion and occupation of Hawaii? What were the logistical challenges that prevented them attempting this? Was a full invasion considered by Japan during the planning of the attack?,WWII Invasion of Hawaii,2019-07-07 12:46:48
AskHistorians,blu_skydive,0,28,"I got thinking about this due to current world events and the worrying rise of national populism. I see history repeating itself to lesser extent but it's still worrying nonetheless. 
Wondered how long it took the majority of the German population to see the error of its ways and reverse its thinking? 

I hope this isn't a stupid question.",I'm interested to know how the political attitude in Germany changed after WW2 from what appeared to be predominantly nationalist and anti-semitic facism to the democracy we know today.,2019-07-06 08:10:07
AskHistorians,warlord91,0,1,"We have all heard the stroys of  how he was one of the first travelers/ trappers to brave the southern lands of kentucky but who was daniel?

Are there any other stories that are lesser known to people?

Are there any good books based on him or tell about who who was from beginning to end?

My dad and I were discussing him recently.

Just got into tennesse and he brought up how he was really intrested in him so if anyone has some good info please share.",Daniel Boone americas first hero.,2019-07-07 22:25:28
AskHistorians,Doe22,0,1,,How much political power could women wield in the Abbasid Caliphate?,2019-07-07 13:22:47
AskHistorians,Nanak_,0,1,Was there already some dissent in the roman empire and these people were viewed as liberators? Or were they viewed as occupiers and there was a large clash of cultures?,How did roman citizen vew the germanic tribes who invaded in the age of migration,2019-07-07 14:31:15
AskHistorians,Echo_Onyx,0,1,Results on the internet have shown little but about the weather. How did he contribute towards the plan and how did he help organise the troops?,How did General Eisenhower plan for D-Day?,2019-07-07 18:15:58
AskHistorians,mathbaker,0,4,"ERA is reported as the total innings pitched, with the fractional part reported as a 0, 1, or 2 after a decimal point. Who decided to use this as a stat? When was it first used? Was there any debate about this method?
In other words, who discussed it and what was the discussion?",Who decided to use a base 3 stat in reporting ERA in baseball?,2019-07-07 21:54:42
AskHistorians,Markovski,0,1,"I'm interested in any science, but to give the question some more focus, what do we know about metallurgy? What metals were they smelting, what did they make with the metals?     

We're there ever any extended reductions in advancements like we see in the dark ages in European History?",What do we know about scientific developments in Central and South America before 1600's? Specifically metallurgy.,2019-07-07 14:20:47
AskHistorians,BEEFCRAB,0,12,"I periodically come across articles arguing there were no 'dark ages' as commonly understood. The argument is basically that previously underappreciated social and technological advances make the term misleading and pejorative. The wiki page on the historiography of the dark ages also says modern historians avoid the term. 

However, as far as I am aware, western europe after the fall of the roman empire still lacks written records, was indeed very violent, and was ultimately so bad that even feudalism seemed like a good idea. Dark age Europe seems genuinely dark compared to what came before and after, and what was going on elsewhere at the time. 

Why is it now considered wrong to think of the early middle ages as the ""dark ages"", or refer to is as such? The term seems apt",Question on the use/misuse of the term 'dark ages',2019-07-07 03:01:45
AskHistorians,cabblesnop,0,1,,Within the Viking Age how important were their Gods play into every day life and war times?,2019-07-07 15:43:48
AskHistorians,zpgdixgu,0,1,"So in the 5th century when the Germans were in the Italian peninsula, why didn't people of Italy go hmm maybe we should join the army? Why was there such a fatal recruiting issue with the legions? One of the things that made Rome so resilient in the beginning fighting Pyrrhus and Carthage was its ability to field legions again and again. What happened? People just stopped giving a fuck? It can't have been THAT depopulated?",Late Roman Empire Recruitment Problems,2019-07-07 14:09:53
AskHistorians,GeneralWalters421,0,7,"I recently saw Barry Lyndon, (set during the 7 Year War) and in one of the scenes it depicts a small skirmish between a line of Austrians and British. It is supposed to depict a unrecorded skirmish.

My question is, would this be common to have smaller skirmishes alongside bigger battles during this period? And if so, would it be around larger armies when traveling, or would there be skirmishing along a ‘front line’ if such a concept existed? 

I guess I will also ask very broadly about all pre 1900s history, and about how warfare worked during that period. Because in media, they seem to focus on large battles as turning points, but you never get a sense of supply lines, prolonged sieges, the frontline (again, if such a concept existed) and really just the bigger picture.","How common where smaller skirmishes during the early modern and medieval era, compared to larger battles? And how did warfare work before the late modern age, in terms of the larger war, and not just battles?",2019-07-07 09:03:51
AskHistorians,TheGOATofgoats999,0,2,I looked up images online and it seems they didn't wear armor but they did wear helmets. Is this accurate?,What kind of weapons and gear did the Germanic tribes use in their battles against the Romans?,2019-07-07 07:32:46
AskHistorians,FlasKamel,0,11,"Or are we mostly guessing based on instruments we know they had at the time, and other contemporary music? I've been really interested in finding some actual music from that era, but only seem to find music that appears to be what people 'guess' it sounded like.   


I also read some posts about how little actual written history there is from this time and place. Is Norwegian (or just Scandinavian) viking age music kinda lost in time, or are there specific examples of actual songs out there?  


Note that I'm obviously not too well informed on the viking age or Norwegian history in general, but I'd like to explore my country's musical background.",Are there any actual known music pieces from the Norwegian (or just Scandinavian) viking age?,2019-07-07 10:10:47
AskHistorians,The_Aerondight,0,1,How reliable do historians consider the Secret History to be? It seems to me that it is a blatantly obvious anti-Justinian/Belisarius propaganda piece. I was surprised Procopius didn't accuse them of kicking puppies for fun.,Procopius and the Secret History,2019-07-07 21:25:32
AskHistorians,Therealdalemorgan,0,1,,Were there reports of a large amount of alcohol-related deaths once prohibition was repealed in America?,2019-07-07 21:25:22
AskHistorians,SignedName,0,1,"There was a recent r/badhistory thread that disputed whether or not the Massacre of the Latins should be considered a massacre at all, so I was wondering how many people actually died, and why the killings were so exaggerated if they were?",How many people were actually killed in the Massacre of the Latins?,2019-07-07 17:39:35
AskHistorians,SillyDillySwag,0,1,,"Why were a multitude of Spanish-speaking countries established in the Americas after the independence of New Spain rather than a single, united country?",2019-07-07 15:26:45
AskHistorians,CoachSDot,0,1,I had a talk with a friend about how the Vietnamese had “Black man go home” and “This is not your war” signs everywhere during the war. Of course it’s not like black men could actually leave but it’s interesting. Want to confirm it and maybe tell them more about it if you all have that info.,"During the Vietnam War, what were the attitudes the Vietnamese had toward non-white Americans. Particularly Asian and African Americans who did not have full legal rights at the time of the war.",2019-07-07 21:23:22
AskHistorians,Killingon9gag,0,1,,How and who came up for names of the Animals which are roaming on Earth since homo sapiens. e.g. who came up with name Lion or Elephant ? and how ?,2019-07-07 21:14:51
AskHistorians,reallyepicman,0,1,,"During French Indochina, why did Vietnam adopt the Latin script in their alphabet, but not Cambodia and Laos?",2019-07-07 01:35:48
AskHistorians,Bluntforce9001,0,1,"Or more broadly, how was menstruation understood through the theory of humors?",Did European women try to rebalance their humors during menstruation?,2019-07-07 13:36:11
AskHistorians,Koppek,0,3,I have searched the Internet for a while now and only found conflicting answers about which state in America it was created in. A concise answer would be greatly appreciated as this is very frustrating.,Where is the exact birthplace of Rock and Roll?,2019-07-07 21:07:24
AskHistorians,imrduckington,0,2,"As commonly know, Hannibal’s army had forty elephants when he started his crossing of the alps. Most of them died on the trip. My question is whether the remaining ones helped a lot or even hindered Hannibal’s successes because of their needed food intake, speed, and ease of identification.",How much did Hannibal’s forty elephants help his successes in the second Punic war?,2019-07-07 21:07:22
