subreddit,author,locked,num_comments,selftext,title,timestamp
AskHistorians,AutoModerator,0,84,"[Previous](/r/AskHistorians/search?q=title%3A""Sunday+Digest""+OR+title%3A""Day+of+Reflection""&amp;restrict_sr=on&amp;sort=new&amp;t=all)

Today: 

Welcome to this week's instalment of /r/AskHistorians' Sunday Digest (formerly the Day of Reflection). Nobody can read all the questions and answers that are posted here, so in this thread we invite you to share anything you'd like to highlight from the last week - an interesting discussion, an informative answer, an insightful question that was overlooked, or anything else.","Sunday Digest | Interesting &amp; Overlooked Posts | July 01, 2019–July 07, 2019",2019-07-07 14:04:52
AskHistorians,AutoModerator,0,1,"[Previous weeks!](/r/AskHistorians/search?sort=new&amp;restrict_sr=on&amp;q=flair%3ASASQ)

**Please Be Aware**: We expect everyone to read the rules and guidelines of this thread. Mods *will* remove questions which we deem to be too involved for the theme in place here. We *will* remove answers which don't include a source. These removals will be without notice. Please follow the rules.

Some questions people have just don't require depth. This thread is a recurring feature intended to provide a space for those simple, straight forward questions that are otherwise unsuited for the format of the subreddit.

Here are the ground rules:

* Top Level Posts should be questions in their own right. 
* Questions should be clear and specific in the information that they are asking for.

* Questions which ask about broader concepts may be removed at the discretion of the Mod Team and redirected to post as a standalone question.
* We realize that in some cases, users may pose questions that they don't realize are more complicated than they think. In these cases, we will suggest reposting as a stand-alone question.

* Answers **MUST** be *properly* sourced to respectable literature. Unlike regular questions in the sub where sources are only required upon request, the lack of a source *will* result in removal of the answer.
* Academic secondary sources are prefered. Tertiary sources are acceptable *if* they are of academic rigor (such as a book from the 'Oxford Companion' series, or a reference work from an academic press).

* The *only* rule being relaxed here is with regard to depth, insofar as the anticipated questions are ones which do not require it. All other rules of the subreddit are in force.","Short Answers to Simple Questions | July 10, 2019",2019-07-10 14:05:16
AskHistorians,tiikerinsilma,0,26,"I'm asking this partially because the atrocities committed by Japan seem seriously overshadowed by those done by Germany and even USSR during the war. (In popular consciousness.) Regarding post-war plans, we know of Generalplan Ost and so forth from the Nazis, directly stating their genocidal intent. 

Did Japan ever make similar plans or documents for the future of areas they planned to conquer? Did these plans include genocidal intent in the same way as Generalplan Ost?","(WW2) Did Japan have genocidal plans for Asia, had they won the war?",2019-07-10 09:09:07
AskHistorians,Mr_Quinn,0,10,,"In 1627 the last aurochs, or wild cow, died in the Jaktorów Forest of Poland. How did Europeans of that time understand the concept of extinction? Were they aware that these animals were the last of their kind, and their death meant the end of the species?",2019-07-10 14:00:39
AskHistorians,Erezen,0,14,"Moreover, how was the movie received in South Africa itself, given its relatively even-handed portrayal of black characters, especially Xi, the Khoisan protagonist? Was there backlash from the conservative echelons of white South African society?

(And yes, I know there's a number of noble-savage elements with Xi's character and I'm aware of the not-great background of the film when it comes to the Khoisan people involved in it, but I do wonder how a) such a movie was made in South Africa at the time and b) how it managed to overcome South Africa's pariahood in the international community.)

EDIT: Altered my followup question to be closer to what I mean.","""The Gods Must Be Crazy"" is a beloved South African movie released in 1980, during the most bitter years of the anti-apartheid struggle. How did it manage to overcome boycotts and South Africa's pariah status to become such an adored cult classic?",2019-07-09 20:36:09
AskHistorians,DrKarenDempsey,0,259,"**Thanks very much for having me, I’ve got to stop answering questions and get back to writing an article about medieval gardens and women's daily life. It's been so much fun - I really had to think fast with all of your great questions. I wish I could answer everything!! I'm on twitter @karrycrow (but not always posting about medieval!!)**

&amp;#x200B;

I am Dr Karen Dempsey, a medieval  archaeologist based at the University of Reading where I am currently a Marie Skłodowska-Curie Fellow - basically a post-doctoral researcher. My current project is called Herstory. It focuses on understanding medieval castles, from a feminist perspective....in other words telling inclusive stories of people living in castles beyond war, power (or horses!!). I am particularly interested in medieval women, my work includes studies of the things they used loved and care about as well as they places they lived - castles. I am also interested in eco-feminism, female devotional practice (in the garden - sowing seeds as prayers anyone??). I am also interested in how modern communities engage with material heritage especially in relation to castles.

&amp;#x200B;

You can read more about me here  [https://medievalcastlesandwomen.wordpress.com/](https://medievalcastlesandwomen.wordpress.com/)  or on my staff page  [https://www.reading.ac.uk/archaeology/about/staff/k-dempsey.aspx](https://www.reading.ac.uk/archaeology/about/staff/k-dempsey.aspx)

&amp;#x200B;

PROOF:  [https://twitter.com/karrycrow/status/1147140350823325696](https://twitter.com/karrycrow/status/1147140350823325696)","IAMA archaeologist who specialises in medieval castles but have a particular interest in women's lives (elite and ordinary). AMA about daily life at castles, what we know now that we didn't know before, did it matter where a medieval person sat in the hall? How different were toilets then to now?",2019-07-09 15:12:54
AskHistorians,Bellajoey,0,15,I thought I heard once that it was tied to English archers. That when they were captured by the enemy their middle fingers were removed to make them unable to use a bow. Is this true?,What is the origin of the middle finger being a symbol of disrespect?,2019-07-10 04:24:10
AskHistorians,xlhat,0,1,"[This](https://i.redd.it/ebrj4ee3rg931.png) post claims that the CIA funded the Contras by hiring drug traffickers which ultimately led to the crack epidemic that plagued the inner cities.

Is this true ? Did the CIA really flood American cities with drugs or turned a blind eye to it ?",Did the CIA spark the inner cities crack epidemic ?,2019-07-10 16:26:51
AskHistorians,Seeking_Psychosis,0,1,,"The Turks are one branch of the Turkic people's who migrated into West Asia from the Central Asia steppe. How long did it take before the Turks started looking, acting, and sounding less ""Asian"" and more ""Middle Eastern"" in the eyes of other West Asian and European countries? [Attempt #2]",2019-07-10 14:02:26
AskHistorians,droidbrain,0,1,And a related question: just how much of a republic was the Novgorod Republic?,The Princes of Novgorod were traditionally invited from neighboring states. Why did the Novgorodians choose outsiders to rule?,2019-07-10 12:25:56
AskHistorians,w2555,0,5,"I know written records from that far back can be difficult to find, so I was wondering if we had any idea how they handled things like loans and banking, since neither currency or banks were really a thing yet. Did the government, or whatever passed for it, collect taxes as just a portion of whatever a person produced, so they ended up with piles of random valuable things filling the treasury? How did the government move wealth from one side of the ""nation"" to the other, to pay for things like troop salaries or construction projects? How did people have ""savings"" if they were paid in salt or beer? Do we have any idea how prevalent debt was, how much the average citizen owed, if anything? If someone wanted to build a business like a brewery or something, how would they secure financing to cover startup costs?","How well understood are the financial systems of ancient civilizations, such as Sumeria, Egypt, Assyria, etc?",2019-07-10 08:42:55
AskHistorians,conbutt,0,3,"So I've been curious to how naval warfare was conducted in the Indian Ocean as I'm only familiar with the calm-water war galleys, and the modern era sailing ships of Europe. 

&amp;#x200B;

I've read that the Arabs and Indians used the Dhow to transport goods, but was there something like the War Dhow?",What was the primary warship of the Indian Ocean before the advent of the modern period?,2019-07-10 09:13:53
AskHistorians,Zeuvembie,0,1,"I was reading about how Tisquantum (Squanto) was kidnapped and virtually enslaved, and how Sir Ferdinando Gorges likewise captured other Native Americans and sent them back to Europe...but why?",Why Did the English Kidnap Native Americans and Send Them To Europe During the 17th Century Phase of Exploration?,2019-07-10 10:23:08
AskHistorians,Mackteague,0,1,,Which spread quicker: The Black Death itself or news of the Black Death?,2019-07-10 12:11:27
AskHistorians,TanktopSamurai,0,1,,"When Ancient Greek texts were being translated to Arabic, would the translators been able to speak the contemporary Greek spoken in Constantinople? Did the scholars of Middle East interact with the Greek scholars?",2019-07-10 13:11:36
AskHistorians,Elissa_of_Carthage,0,1,"Medieval monasteries were the ones to preserve stories from our past, but their views must have clashed with those these previous civilizations held. How did they react to, for instance, the many mentions of homosexual acts and relationships found in ancient Greek mythology? Did they preserve them or do we know whether they were censored? Did they keep them and comment on them from a Christian point of view? Do we know whether there are records that were erased from history because they disagreed with what was depicted on them?",How did medieval people in monasteries who copied and preserved ancient texts react to the approach to sexuality from those civilizations?,2019-07-10 12:45:14
AskHistorians,Lundy98,0,43,"While the outcome of Petrovs' actions was the best it could have been, he literally had one job and he failed to do it. Did he face any kind of punishment from the Soviet army/state? Did he receive any commendations?","Did Stanislav Petrov, the Soviet officer who failed to launch a counter-attack on the United States when his missile detection system told him they were under attack, ever face any repercussions for his hesitation?",2019-07-09 08:31:51
AskHistorians,HumbertHaze,0,1,"I am using Larry Kramer's famous essay '1,112 and Counting' for the estimate: http://bilerico.lgbtqnation.com/2011/06/larry_kramers_historic_essay_aids_at_30.php","In March 1983, there were approximately 1,112 reported AIDS cases in the US. Do we have any measure of how many, if any, of those people are still alive?",2019-07-10 13:33:29
AskHistorians,CecilChubb,0,3,Is it a mistake to focus too much on Hitler when trying to understand the era and the causes of WWII?,Is Hitler himself integral to how Nazism developed as an ideology? Or was he just one part of it all?,2019-07-10 15:23:36
AskHistorians,Dora_De_Destroya,0,3,"Im imagining that for several months, there would be 1 man for every 10 women. So my question is during that time, were women the majority gender in the population? If that was the case, was the general vibe of the time more centric? Would ads target women. Would movies and TV shows and magazines women centered? Was there more of a ""girl power"" vibe? Or was it business as usualm","With about 10 million men drafted for WW2, what was life like in cities? Was there an obvious lack of men on day to day functions? (i.e going grocery shopping or in traffic) And was the culture more women centered?",2019-07-09 20:01:13
AskHistorians,Omny87,0,2,"When reading about witches in medieval Europe, I often come across the supposed origin of witches flying on broomsticks- namely, that witches would perform rituals by smearing broomsticks and similar staffs with an ointment made from psychotropic plants and berries like deadly nightshade and belladonna, which they would either ""ride"" like a hobby horse while nude, or even use as a dildo to cause hallucinations like seeing demons or sensations of flight. 

However, something feels off about this story- I can't explain exactly how or why, but it reminds me of a lot of apocryphal historical tidbits that are often touted as fact but have no concrete evidence to back it up. Can anyone here set the record straight?","Did medieval witches really use psychedelics to ""fly on broomsticks""?",2019-07-10 11:21:40
AskHistorians,RailroadRider,0,2,,"How long have humans been recycling metal? Is it possible that part of say, my car, could have been in world war ships or ancient swords?",2019-07-10 00:41:06
AskHistorians,IonOrchid1,0,1,"(also interested in this same question for other continents, but it was a bit more difficult to think of an example for them)",How aware of the ocean were inland people like the Pawnee or Cheyenne prior to European contact?,2019-07-10 14:28:17
AskHistorians,The_Manchurian,0,1,,"During the 17th century, many people in Europe accused of witchcraft and put on trial confessed to witchcraft, cursing, congress with Satan, etc... without being tortured. Why?",2019-07-10 16:01:11
AskHistorians,Memeoligy_expert,0,1,Was the Red Army Choir formed from actual soldiers or were they just singers? Thanks.,About the Red Army Choir,2019-07-10 08:56:56
AskHistorians,_Fredder_,0,2,,When did locking one's home become a common practice?,2019-07-10 12:48:37
AskHistorians,HoldenHunter28,0,4,From Napoleon to Hitler many countries tried to take over the Russian lands but failed miserably. What features about Russia make it so uncounquerable?,Throughout History many nations had tried to conquer Russia but failed. What features about Russia make it so hard to counquer?,2019-07-10 15:57:56
AskHistorians,SavyRoma66,0,7,"I apologize in advance for the general question! Perhaps this might not even belong here, it might be more of a sociology question. I am not sure but I hope someone here can shed some light. 

&amp;#x200B;

Time: Before writing became commonplace

Place: I am going to assume that would be not as relevant as I expect the same principle to apply more or less universally.  I hope that is okay. 

&amp;#x200B;

Clarification: I am aware that over the many years oral traditions would change and alter but today I heard a claim (in the context of mythology and meta-stories) that over time, orally passed-down stories, specifically myth stories, were stripped down to their essense and any irrelevant details were dropped, leaving behind only the details which had a meaning. This seems to be counter-intuitive as I would have expected the exact opposite to happen: over time stories would become more and more embellished with each generation adding something to the story. Is it possible to make a general claim (i know, terrible) about the validity of this?

&amp;#x200B;

I am aware there will be scant, if any, evidence for the gradual progression of oral stories but perhaps we can draw some conclusions (gasp!). Google has not been very helpful -unsurprisingly-I really hope someone on here can at least point me in the right direction. Much appreciated!",Were oral traditions embellished over time?,2019-07-10 10:27:21
AskHistorians,kekniger,0,2,"I understand that there are conflicting opinions with the traditionalist and revisionist viewpoints, but I struggle to find any works that really argue the extent to which the bombs caused the surrender (more so how necessary they were)","To what extent were the atomic bombs dropped on Hiroshima and Nagasaki, the reason for the Japanese unconditional surrender?",2019-07-10 09:14:19
AskHistorians,Dynd,0,3,"I was just browsing around on ancient Roman Wikipedia pages, and I see a lot of historical people have a bust or statue as their portrait. It seems that in most cases they know who the bust represents. But how? Is there a name etched on the bottom or something?","When archeologists dig up an ancient bust, how do they know who it is?",2019-07-10 05:54:11
AskHistorians,latenightresearch,0,1,I heard this while visiting Yad Vashem.,Is it true that Jews were over-represented in the German army during World War 1?,2019-07-10 12:44:22
AskHistorians,Kedmed,0,1,,Where did the concept of swords come from and how did the world come to know them?,2019-07-10 17:24:50
AskHistorians,Harvey_Specter_Esq,0,1,,"Did American re-education camps for german POWs actually work, meaning did Germans see the flaws in Nazi-ism? What happened to the POWs upon release?",2019-07-10 13:26:14
AskHistorians,RatCity617,0,2,"My example for this question is the battle of the Somme, how much time must pass before it's no longer desecrating graves, but archeology? Is there a time frame, or other criteria?",How much time must pass before historians can comb historical sites?,2019-07-10 02:54:26
AskHistorians,kane-is-able,0,1,During the reign of terror? Early ? Pre-Napoleon?,Was torture as a means of extracting confessions of guilt/treason used during the French Revolution?,2019-07-10 09:44:48
AskHistorians,NoctisRex,0,1,Hello. A friend just read Clash of Civilisations and we discussed some of the problems with it. She then asked me for an alternative but I didn't know of any so I'm hoping to get one from here. Thanks in advance.,Alternative book to Clash of Civilisations by Samuel Huntington?,2019-07-10 16:32:04
AskHistorians,ndecuzzi,0,2,"Specifically, what were their general beliefs and what was the country / time of origin?","Medieval Europe had alchemy, but what other ""sciences"" existed throughout time similar to this?",2019-07-10 07:34:17
AskHistorians,TirousDidAThing,0,2,,"I've read that the Greek/Roman statues we see were not only painted, but even clothed with fabrics and robes. How much of this is true? What did Greco-Roman artists intend for their works to look like?",2019-07-09 23:09:23
AskHistorians,Ser_Smaug,0,1,,What was the contemporary reaction to the assassination of Sakamoto Ryōma? Did it contribute to the increase in political tensions in Japan prior to the Boshin war?,2019-07-10 16:00:44
AskHistorians,Snkarshana,0,1,,Is it true that most Europian countries would be poverty stricken today if they had not engaged in colonisation?,2019-07-10 13:44:51
AskHistorians,CecilChubb,0,1,"There is a scene where the Mikhail Shchadov, the minister for coal industries, gets threatened by coal miners and gets his pastel suit smeared with coal.

After some digging (no pun intended), I'm fairly sure the scene didn't happen. It seems that the real Shchadov was just as much of a coal miner in his youth as anyone could be, and presumably wouldn't have stood up for any bullshit.

But could such a scene even happen in the USSR at that time? Would workers be able to talk back to authority without being killed?",Could miners have casually disrespected a Soviet minister in 1986 as portrayed in HBO's Chernobyl?,2019-07-10 15:41:33
AskHistorians,Koraks,0,1,"I'm very curious as to what made some people choose the land option vs the sea option. 

It seems that land routes had very obvious challenges that are well known - namely, crossing the Sierras before winter fell. But it seems like less is talked about the sea routes for getting to California - was this a safer option? Was it more expensive? Were there other reasons why some people chose one option over the other? Did the tragedy of the Donner party make more people less keen on taking the land route to California?

The extent of my formal education on this topic is from my elementary school education, and I was hoping to get more insight on this from historians!",What were the advantages/disadvantages of land versus sea routes for travel to California in the 1800's?,2019-07-10 15:34:24
AskHistorians,fisch09,0,11,"For instance what strategies would/do you take to rule out whether or not a story from the early Roman empire is a tale that was meant as a comedy, sarcasm, or parable and not a factual story.",How do Historians recognize/rule out humor or sarcasm from historical texts?,2019-07-09 17:48:20
AskHistorians,EthicalCaesar,0,1,Did Arab or North African cultural influences make it to the table? Any visible signs evident today?,The muslim Umayyad dynasty’s influences on Spanish food,2019-07-10 18:29:58
AskHistorians,EthicalCaesar,0,1,Since when has the idea of one race being superior existed? Was it always based on racism? Has there been any instances where a population with darker skin tried to subjugate a lighter skin populations?,Hierarchies based on race in history,2019-07-10 18:19:46
AskHistorians,Skaldenmet,0,1,"Instruments were used to give commands to the troops (e.g. 1 horn blow for attack, 2 for retreat and so on) but since some instruments were predestined to serve for this purpose and i suppose that no one would meet before battle to clarify that no one has the same number of signals, how would for example a viking fighting against saxons know which of the horns he has to listen to?",How did the troops know which signals were meant for them?,2019-07-10 18:18:06
AskHistorians,CyanidePathogen2,0,1,I’ve recently been interested in learning about the 30 Years War and was wondering how combat would’ve been like.,What was combat like during the 30 Years War,2019-07-10 14:28:07
AskHistorians,mimicofmodes,0,2,"I'm traveling in Italy at the moment, and the limited historical context given on plaques and museum labels is making me so curious to build a fuller picture. I'm largely interested in domestic life, the family, gender roles, women, social institutions, servants, dress, and class - to throw a bunch of interrelated topics at you.

My preference is for academically-published books or very rigorous popular history (in English). I don't know if this is as important a thing to specify as it is for English history, but I'm not really looking for anything that focuses on these issues entirely through the lens of literature.

Thank you!",Looking for social history texts on late medieval/early Renaissance Italy,2019-07-10 12:10:14
AskHistorians,dprabakaran,0,1,,"Did the Mexican-American war reignite tensions previously resolved by the Missouri compromise, or was it the compromise of 1850.",2019-07-10 14:14:04
AskHistorians,xdwp,0,1,,What did the German World War I veterans think about the start of the World War II?,2019-07-10 08:16:01
AskHistorians,long_schlong_silver0,0,5,"Why are baseball, basketball, and American football so much more popular than any other international sports, why did they come about, and why has the same situation not occurred anywhere else in the world?

EDIT:
I do know the story of why the USA plays American football instead of rugby ( good video here by squidgerugby giving a brief overview https://youtu.be/DrSNe0DIlTw ) but it still doesn't really explain football (soccer) not breaking the market there",Why does America have 3 huge sports that only they play?,2019-07-10 14:12:48
AskHistorians,LatakiaBlend,0,1,,I'm a relatively wealthy Englishman in the late 17th century. I would like to buy land in the American colonies. How would I go about doing that?,2019-07-09 21:47:05
AskHistorians,Asgarthe,0,1,,"On paper, it seems that the British should defeated the colonies in the American Revolutionary War. What were the most important strategic mistakes they made that led to their defeat?",2019-07-10 17:49:16
AskHistorians,Sarsath,0,1,,How did medieval Christian Europeans generally view black people?,2019-07-10 17:45:44
AskHistorians,MrShupple,0,7,"I remember their names still: Columbus, De Gama, Francis Drake, Magellan. The unit also seemed to go into detail about the conquistadores Cortez and Pizarro and the search for the fountain of youth. Was the so-called ""Age of Exploration"" a largely European phenomenon, or were there explorers in China, Japan, and India (to name a few) sailing EAST across the Pacific to find new routes to Europe?","I learned about the ""Age of Exploration"" in school, but it seems to be Euro-centric. Were Asian explorers attempting to reach the ""New World"" during this time as well?",2019-07-10 02:54:06
AskHistorians,Donute1337,0,1,"I always hear sand see the oppression African Americans went through, but never heard anything about other minority’s.",Did Hispanics and Asians receive the same treatment as African Americans did during the civil rights era?,2019-07-10 17:35:58
AskHistorians,curiow,0,1,I've always wondered how different the materials are now compared to the one used in sailboats.,"What are the sails of Spanish galleons (mainsail, foresail, etc) made of?",2019-07-10 11:35:54
